section_id,ProcessedHeading,ProcessedContent,WHAT,WHY,How,When,Who,References,Contribution,Other
1138,test cases,misc expression language injection cve abstr_number abstr_number apache roller ognl injection cve abstr_number abstr_number local file include web inf web xml retrieved local file include spring application context retrieved local file include struts xml retrieved local file include weblogic xml retrieved local file include ibm bnd xml retrieved local file include ibm web ext xmi retrieved local file include ibm web ext xml retrieved local file include etc shadow retrieved local file include etc passwd retrieved http auth weak password web inf application configuration files retrieved status servlet cve abstr_number abstr_number snoop servlet cve abstr_number abstr_number extended path traversal scan ajp service detection thanks abstr_hyperlink spring boot actuator console utf abstr_number response splitting management endpoints pivotal spring traversal cve abstr_number abstr_number apache struts apache struts abstr_number abstr_number abstr_number thanks abstr_hyperlink apache struts abstr_number abstr_number abstr_number apache struts abstr_number abstr_number abstr_number apache struts abstr_number abstr_number abstr_number apache struts abstr_number abstr_number abstr_number apache struts abstr_number abstr_number abstr_number apache struts devmode enabled apache struts ognl console grails grails path traversal cve abstr_number abstr_number apache wicket apache wicket arbitrary resource access cve abstr_number abstr_number java server faces java server faces local file include cve abstr_number abstr_number cve abstr_number abstr_number jboss seam jboss seam remote command execution cve abstr_number abstr_number incorrect error handling jsf apache struts apache tapestry grails gwt java xml security xinclude support xml external entity information disclosure issues remote jvm version apache tomcat version jetty version oracle application server version oracle glassfish version oracle weblogic version compliance checks web xml http verb tampering web xml url parameters session tracking web xml incomplete error handling web xml invoker servlet jboss jboss web service enumeration jboss admin console weak password jboss jmx web console password protected jboss jmx invoker remote command execution jboss undertow directory traversal cve abstr_number abstr_number jboss jbpm admin console tomcat tomcat manager console weak password tomcat host manager console weak password end life software tomcat weblogic weblogic uddi explorer detection weblogic uddi explorer ssrf vulnerability cve abstr_number abstr_number weblogic admin console weak password oracle application server added check oracle log database accessible added check multiple oracle application server default resources cve abstr_number abstr_number,0,0,1,0,0,0,0,0
1139,install,cookie jar section options sessions enable scanner field load abstr_number eescan jar burp extender tab plugin requires least java abstr_number abstr_number,0,0,1,0,0,0,0,0
1140,contributors,special thanks abstr_hyperlink abstr_hyperlink abstr_hyperlink,0,0,0,0,1,0,0,0
1141,release notes,,0,0,0,1,0,0,0,0
1142,version abstr_number abstr_number abstr_number abstr_number may abstr_number,added check utf abstr_number response splitting added check jboss undertow directory traversal cve abstr_number abstr_number added check nodejs http redirect cve abstr_number abstr_number added check nodejs http response splitting cve abstr_number abstr_number added check management endpoints added check pivotal spring traversal cve abstr_number abstr_number added check jboss jbpm admin consoles adedd check apache struts abstr_number abstr_number abstr_number cve abstr_number abstr_number improved lfi payloads improved injection tests improved axis security checks,0,0,0,1,0,0,0,0
1143,version abstr_number abstr_number abstr_number abstr_number nov abstr_number,added check spring boot actuator console improved lfi module new utf abstr_number payloads improved injection new payloads added check apache roller ognl injection cve abstr_number abstr_number added check apache struts abstr_number abstr_number abstr_number thanks abstr_hyperlink added check weblogic admin console weak password added check oracle application server multiple file disclosure issues added check oracle log database accessible added check ajp service identification added check weblogic uddi explorer ssrf cve abstr_number abstr_number improved performance passive checks improved apache wicket information disclosure improved abstr_number incorrect exception handling added check end life software jetty added check end life software tomcat added check end life software oracle application server added check oracle application server version added check oracle glassfish version added check oracle weblogic version added check apache struts ognl console added check happy axis,0,0,0,1,0,0,0,0
1144,version abstr_number abstr_number abstr_number dev abstr_number feb abstr_number,added check jetty remote leak shared buffers cve abstr_number abstr_number found abstr_hyperlink improved check information disclosure issues remote jvm version added check apache wicket arbitrary resource access added check incorrect error handling apache tapestry added check incorrect error handling grails added check incorrect error handling gwt fixed references injection issue,0,0,0,1,0,0,0,0
1145,version abstr_number abstr_number abstr_number dev abstr_number feb abstr_number,added check information disclosure issues remote jvm version added check information disclosure issues apache tomcat version added check weak password http authentication fix bugs issues reporting,0,0,0,1,0,0,0,0
1146,version abstr_number abstr_number abstr_number dev abstr_number feb abstr_number,improved lfi checks added initial support compliance checks,0,0,0,1,0,0,0,0
1147,version abstr_number abstr_number abstr_number jan abstr_number,added checks apache axis abstr_number added checks jboss admin console weak password added checks jboss jmx invoker added checks status servlet added checks snoop resources added checks apache tomcat host manager console multiple bug fixes pushed abstr_hyperlink,0,0,0,1,0,0,0,0
1148,version abstr_number abstr_number abstr_number abstr_number oct abstr_number,initial public release,0,0,0,1,0,0,0,0
1149,buildship eclipse plug ins gradle,buildship set eclipse plug ins provide deep integration gradle eclipse buildship hosted abstr_hyperlink,1,0,0,0,0,0,0,0
1150,requirements,buildship used eclipse abstr_number abstr_number newer older versions eclipse might work tested explicitly depending version gradle buildship interacts,0,0,1,0,0,0,0,0
1151,documentation,documentation buildship users developers hosted abstr_hyperlink specifically,0,0,0,0,0,1,0,0
1152,discussions news,interested feedback gradle eclipse communities things buildship discussed abstr_hyperlink abstr_hyperlink,0,0,0,0,1,1,0,0
1153,issue tracking,report issues find buildship well gradle abstr_hyperlink buildship issues abstr_hyperlink gradle issues,0,0,0,0,0,1,0,0
1154,license,buildship available eclipse public license,0,0,0,0,1,0,0,0
1155,begin,abstr_hyperlink abstr_hyperlink abstr_hyperlink mean full stack javascript open source solution,0,0,0,0,0,1,0,0
1156,prerequisites,make sure installed prerequisites development machine node abstr_hyperlink npm package manager,0,0,1,0,0,0,0,0
1157,downloading mean,several ways get mean boilerplate,0,0,1,0,0,0,0,0
1158,generator,recommended way would use abstr_hyperlink generate latest stable copy mean boilerplate supplies multiple sub generators ease daily development cycles,0,0,1,0,0,0,0,0
1159,cloning github repository,also use git directly clone mean repository abstr_code_section clone latest version mean repository meanjs folder,0,0,1,0,0,0,0,0
1160,downloading repository zip file,another way use mean boilerplate download zip copy abstr_hyperlink also using wget command abstr_code_section forget rename mean master project,0,0,1,0,0,0,0,0
1161,quick install,downloaded boilerplate installed prerequisites,0,0,1,0,0,0,0,0
1162,running application,install process,0,0,1,0,0,0,0,0
1163,development deployment docker,install abstr_hyperlink install abstr_hyperlink local development testing fig abstr_code_section local development testing docker abstr_code_section enable live reload forward abstr_number port mount app public volumes abstr_code_section,0,0,1,0,0,0,0,0
1164,running secure environment,run application secure manner need use openssl generate set self signed certificates unix based users use following commnad abstr_code_section windows users follow instructions found abstr_hyperlink generate key certificate place sslcert_ folder,0,0,1,0,0,0,0,0
1165,getting started mean,application running lot stuff understand,0,0,1,0,0,1,0,0
1166,community,use abstr_hyperlink learn changes roadmap join meanjs freenode discuss new abstr_hyperlink ping abstr_hyperlink abstr_hyperlink,0,0,0,0,1,0,0,0
1167,live example,browse live mean example abstr_hyperlink,0,0,1,0,0,1,0,0
1168,credits,inspired great work abstr_hyperlink mean coined abstr_hyperlink,0,0,0,0,1,0,0,0
1169,license,mit license permission hereby granted,0,0,0,0,1,0,0,0
1170,icdm abstr_number,icdm abstr_number drawbridge cross device connections challenge third prize solution,1,0,0,0,0,0,0,0
1171,instalation,software implemented python uses external software xgboost libraries python needed numpy http www numpy org scipy http www scipy org abstr_hyperlink xgboost software downloaded xgboost https github com dmlc xgboost challenge used version abstr_number abstr_number,0,0,1,0,0,0,0,0
1172,settings,software contains two setting files variables contains environment variables software needs environment variable absolute path every file provided challenge environment variable python wrapper folder xgboost environment variable path save load model variablestst contains two environment variables environment variable absolute path test file environment variable absolute path file results submit kaggle edit variables variablestst use values files path contains wrapper installation xgboost procedure train makes use variable procedure test makes use variable variabletst uses variable model big data structures practical load training files saving loading,0,0,1,0,0,0,0,0
1173,requirements,experiments executed abstr_number abstr_number server abstr_number gbytes abstr_number intel xeon abstr_number processors one abstr_number cores hyperthreading technology operating system linux gentoo abstr_number ram enough,0,0,1,0,0,0,0,0
1174,running code,train algorithm create model python train use model make predictions test file python predict,0,0,1,0,0,0,0,0
1175,description algorithm,preprocessing initial stage,0,0,1,0,0,0,0,0
1176,feature extraction,section contains description every feature contained training test sets abstr_number device features device type device device country device annonymous abstr_number device annonymous abstr_number device annonymous abstr_number device annonymous abstr_number device annonymous abstr_number device annonymous abstr_number number addresses associated device number properties associated device abstr_number cookie features cookie computer cookie browser version cookie country cookie annonymous abstr_number cookie annonymous abstr_number cookie annonymous abstr_number cookie annonymous abstr_number cookie annonymous abstr_number cookie annonymous abstr_number number addresses visited cookie abstr_number relational features created sets order extract features represent relation device cookie setip contains addresses appear less ten devices less twenty cookies visited device cookie set empty include every address visited device cookie setotherdevices set contains every device training set handle cookie except device pattern setotherip set contains addresses visited device setothercookies setotherp roperties set contains properties visited device setothercookies using sets created following features number addresses visited device cookie number addresses appear less ten devices less twenty cookies visited device cookie number devices setotherdevices number addresses device common setotherip number properties device common setotherp roperties number cookies handle cookie addition features iscell,1,0,0,0,0,0,0,0
1177,definitive guide elasticsearch,repository contains sources definitive guide elasticsearch abstr_hyperlink,1,0,0,0,0,1,0,0
1178,building definitive guide,order build project,0,0,1,0,0,1,0,0
1182,supported versions,definitive guide available multiple versions elasticsearch abstr_hyperlink applies elasticsearch abstr_number abstr_hyperlink applies elasticsearch abstr_number abstr_hyperlink applies master branch elasticsearch current development version,0,0,0,1,0,0,0,0
1183,contributing,contributing change please read contribution guide,0,0,0,0,0,0,1,0
1184,license,work licensed creative commons attribution noncommercial noderivs abstr_number abstr_number unported license see http creativecommons org licenses abstr_number abstr_number full text license,0,0,0,0,1,0,0,0
1185,recorder,,1,0,0,0,0,0,0,0
1186,plugin recording exporting output web audio api nodes,,1,0,0,0,0,0,0,0
1187,syntax,,0,0,1,0,0,0,0,0
1188,constructor,var rec new recorder source,0,0,1,0,0,0,0,0
1190,config,workerpath path recorder worker script defaults recorderjs recorderworker bufferlen length buffer internal javascriptnode uses capture audio tweaked experiencing performance issues defaults abstr_number callback default callback used exportwav type type blob generated exportwav defaults audio wav,0,0,1,0,0,0,0,0
1192,instance methods,rec record rec stop pretty self explanatory record begin capturing audio stop cease capturing audio subsequent calls record add current recording rec clear clear recording rec exportwav callback,0,0,1,0,0,0,0,0
1193,utility methods static,recorder forcedownload blob,0,0,1,0,0,0,0,0
1194,license mit,copyright abstr_number matt diamond permission hereby granted,0,0,0,0,1,0,0,0
1195,pyqver query required python version,greg hewgill abstr_hyperlink,1,0,0,0,0,0,0,0
1196,introduction,script attempts identify minimum version python required execute particular source file developing python scripts distribution,1,0,0,0,0,0,0,0
1197,requirements,script requires least python abstr_number abstr_number,0,0,1,0,0,0,0,0
1198,usage,usage pyqver abstr_number options source report minimum python version required run given source files min version default report version triggers version verbose mode lint print lint style report showing offending line verbose print detailed report version triggers version default minimum version depending whether pyqver abstr_number pyqver abstr_number run,0,0,1,0,0,0,0,0
1199,bugs,currently features detected example,0,0,1,0,0,0,0,0
1220,android cleanarchitecture abstr_hyperlink,sample app part blog post written architect android application using uncle bob clean architecture approach abstr_hyperlink abstr_hyperlink abstr_hyperlink abstr_hyperlink,1,0,0,0,0,1,0,0
1221,clean architecture,abstr_image,0,0,0,0,0,1,0,0
1222,architectural approach,abstr_image,0,0,0,0,0,1,0,0
1223,architectural reactive approach,abstr_image,0,0,0,0,0,1,0,0
1224,local development,useful gradle adb commands executing example gradlew clean build build entire example execute unit integration tests plus lint check gradlew installdebug install debug apk current connected device gradlew rununittests execute domain data layer tests unit integration gradlew runacceptancetests execute espresso instrumentation acceptance tests,0,0,1,0,0,0,0,0
1225,discussions,refer issues section https github com android abstr_number android cleanarchitecture issues,0,0,0,0,0,1,0,0
1226,code style,download install java codestyle https github com android abstr_number java code styles,0,0,0,0,0,1,0,0
1227,license,copyright abstr_number fernando cejas licensed apache license,0,0,0,0,1,0,0,0
1228,rails starter app,abstr_hyperlink abstr_hyperlink abstr_hyperlink abstr_hyperlink abstr_hyperlink starter web application based following technology stack abstr_hyperlink abstr_hyperlink abstr_hyperlink abstr_hyperlink abstr_hyperlink abstr_hyperlink abstr_hyperlink abstr_hyperlink abstr_hyperlink abstr_hyperlink starter app deployable abstr_hyperlink demo http ruby abstr_number rails abstr_number bootstrap heroku herokuapp com gemfile also contains set useful gems performance,1,0,1,0,0,0,0,0
1229,thread safety,assume application thread safe application thread safe know,0,0,1,0,0,0,0,0
1230,heroku platform api,application supports fast setup deploy via abstr_hyperlink abstr_code_section information abstr_hyperlink,0,0,1,0,0,1,0,0
1231,recommended add ons,heroku abstr_hyperlink recommends use following add ons,0,0,1,0,0,0,0,0
1232,secrets yml,rails abstr_number abstr_number abstr_number introduced abstr_hyperlink heroku automatically sets proper configuration variable new applications case need,0,0,1,0,0,0,0,0
1233,tuning ruby rgengc,generational called rgengc introduced ruby abstr_number abstr_number abstr_number rgengc reduces marking time dramatically abstr_number faster however,0,0,1,0,0,1,0,0
1234,nitrous,starter app supports online development abstr_hyperlink need nitrous box least abstr_number memory two dev plan heroku databases one development one test following environment variables nitrous box bashrc abstr_code_section guide creating heroku databases edit bashrc nitrous available http help nitrous postgres,0,0,1,0,0,1,0,0
1235,,geoip abstr_number perl api maxmind geoip abstr_number web services databases,1,0,0,0,0,0,0,0
1236,version,version abstr_number abstr_number,0,0,0,1,0,0,0,0
1237,description,distribution provides api geoip abstr_number abstr_hyperlink abstr_hyperlink api also works free abstr_hyperlink see abstr_hyperlink details web service client api abstr_hyperlink database api,1,0,0,0,0,1,0,0
1238,speeding database reading,module depends pure perl implementation maxmind database reader abstr_hyperlink install libmaxminddb library abstr_hyperlink abstr_hyperlink,0,0,1,0,0,1,0,0
1239,values use database hash keys,strongly discourage using value anynames accessor key database hash names may change releases instead recommend using one following abstr_hyperlink city geoname_id abstr_hyperlink continent code continent geoname_id abstr_hyperlink abstr_hyperlink country iso_code country geoname_id abstr_hyperlink subdivision iso_code subdivision geoname_id,0,0,1,0,0,0,0,0
1240,integration geonames,geonames abstr_hyperlink offers web services downloadable databases data geographical features around world,0,0,1,0,0,0,0,0
1241,reporting data problems,problem find address incorrectly mapped,0,0,0,0,1,1,0,0
1242,versioning policy,module uses semantic versioning described abstr_hyperlink version numbers read yyyzzz,0,0,0,1,0,0,0,0
1243,perl version support,maxmind tested api perl abstr_number abstr_number abstr_number reasonable patches earlier versions perl abstr_number abstr_number applied accept patches support version perl abstr_number abstr_number data returned geoip abstr_number web services includes unicode characters several locales may expose bugs earlier versions perl unicode support important,0,0,1,0,0,0,0,0
1244,support,please report issues code using github issue tracker abstr_hyperlink issue maxmind service specific client api please see abstr_hyperlink details,0,0,0,0,0,1,0,0
1245,authors,dave rolsky drolsky maxmind com greg oschwald goschwald maxmind com mark fowler mfowler maxmind com olaf alders oalders maxmind com,0,0,0,0,1,0,0,0
1246,contributors,andy jack github veracity choroba choroba matfyz graham knop haarg haarg org mateu hunter mhunter maxmind com,0,0,0,0,1,0,0,0
1247,copyright license,software copyright abstr_number abstr_number maxmind,0,0,0,0,1,0,0,0
1248,sharedb,abstr_hyperlink abstr_hyperlink abstr_hyperlink sharedb realtime database backend based abstr_hyperlink json documents realtime backend abstr_hyperlink questions,1,0,0,0,1,1,0,0
1249,features,realtime synchronization json document concurrent multi user collaboration synchronous editing api asynchronous eventual consistency realtime query subscriptions simple integration database abstr_hyperlink horizontally scalable pub sub integration abstr_hyperlink projections select desired fields documents operations middleware implementing access control custom extensions ideal use browsers server reconnection document query subscriptions offline change syncing upon reconnection memory implementations database pub sub unit testing,1,0,0,0,0,0,0,0
1250,quick tour,abstr_code_section,0,0,1,0,0,0,0,0
1251,data model,sharedb view world,0,0,0,0,0,1,0,0
1252,operations,see https github com ottypes json abstr_number documentation supported operations,0,0,0,0,0,1,0,0
1266,liferay connector,abstr_image abstr_hyperlink abstr_hyperlink abstr_hyperlink abstr_hyperlink module,1,0,0,0,0,0,0,0
1267,installation,npm node easily install npm install save liferay connector gittio titanium sdk easily install gittio install liferay connector download module abstr_hyperlink studio_ head abstr_hyperlink download latest packaged module,0,0,1,0,0,0,0,0
1268,usage,example worth thousands words abstr_code_section,0,0,1,0,0,0,0,0
1269,credits,humbly made spry ladies gents smc,0,0,0,0,1,0,0,0
1270,license,library,0,0,0,0,1,0,0,0
1271,data table abstr_hyperlink,abstr_hyperlink,1,0,0,0,0,0,0,0
1272,overview,data table predix component defines data table,1,0,0,0,0,0,0,0
1273,usage,,0,0,1,0,0,0,0,0
1274,prerequisites,abstr_number node abstr_number npm abstr_number bower abstr_number abstr_hyperlink node,0,0,1,0,0,0,0,0
1275,getting started,first,0,0,1,0,0,0,0,0
1276,documentation,read full api view demo abstr_hyperlink,0,0,0,0,0,1,0,0
1277,local development,component directory abstr_code_section component directory,0,0,1,0,0,0,0,0
1278,coding style guide,abstr_hyperlink,0,0,0,0,0,1,0,0
1279,known issues,please use abstr_hyperlink submit bugs might find,0,0,0,0,0,1,0,0
1281,table contents,features comparison libraries supported networks dependencies build examples contributing references license gitter rooms check abstr_hyperlink info,0,0,0,0,0,1,0,0
1282,new,abstr_number abstr_number abstr_number abstr_hyperlink abstr_number abstr_number abstr_number abstr_hyperlink abstr_number abstr_number abstr_number tiny dnn moved organization account,0,0,0,1,0,0,0,0
1283,features,reasonably fast,1,0,0,0,0,0,0,0
1284,comparison libraries,please see abstr_hyperlink,1,0,0,0,0,1,0,0
1285,supported networks,,1,0,0,0,0,0,0,0
1286,layer types,core fully connected dropout linear operation power convolution convolutional average pooling max pooling deconvolutional average unpooling max unpooling normalization contrast normalization forward pass batch normalization split merge concat slice elementwise add,1,0,0,0,0,0,0,0
1287,activation functions,tanh sigmoid softmax rectified linear relu leaky relu identity exponential linear units elu,1,0,0,0,0,0,0,0
1288,loss functions,cross entropy mean squared error mean absolute error mean absolute error epsilon range,1,0,0,0,0,0,0,0
1289,optimization algorithms,stochastic gradient descent without abstr_number normalization momentum adagrad rmsprop adam,1,0,0,0,0,0,0,0
1290,dependencies,nothing need abstr_number compiler,0,0,1,0,0,0,0,0
1291,build,tiny dnn header,0,0,1,0,0,0,0,0
1292,customize configurations,edit include config customize default behavior,0,0,1,0,0,0,0,0
1293,examples,construct convolutional neural networks abstr_code_section construct multi layer perceptron mlp abstr_code_section another way construct mlp abstr_code_section sample,0,0,1,0,0,0,0,0
1294,include tiny_dnn tiny_dnn,,0,0,0,0,0,0,0,1
1295,include tiny_dnn tiny_dnn,,0,0,0,0,0,0,0,1
1296,include tiny_dnn tiny_dnn,,0,0,0,0,0,0,0,1
1297,contributing,since deep learning community rapidly growing,0,0,0,0,0,0,1,0
1298,references,abstr_number bengio,0,0,0,0,0,1,0,0
1299,license,bsd abstr_number clause license,0,0,0,0,1,0,0,0
1300,gitter rooms,gitter rooms discussing new features feel free join,0,0,0,0,1,0,0,0
1301,rampant,rampant launches node application profiler session using abstr_hyperlink paired developer tools frontend inside abstr_hyperlink,1,0,0,0,0,0,0,0
1302,caveats,abstr_number requires mac abstr_number requires abstr_hyperlink abstr_number work app depends stdin,0,0,1,0,0,0,0,0
1303,install,npm install rampant,0,0,1,0,0,0,0,0
1304,usage,node_modules bin rampant path file arguments note must provide fully qualified path script workaround shortcomings path handling abstr_hyperlink,0,0,1,0,0,0,0,0
1305,disclaimer,rampant depends bleeding edge google chrome work correctly abstr_hyperlink node expect software work flawlessly,0,0,1,0,0,0,0,0
1306,license,bsd see license file,0,0,0,0,1,0,0,0
1307,author,reid burke,0,0,0,0,1,0,0,0
1308,bmcustomtableview,abstr_hyperlink abstr_hyperlink abstr_hyperlink abstr_hyperlink,1,0,0,0,0,0,0,0
1309,overview,bmcustomtableview uitableview subclass,1,0,0,0,0,0,0,0
1310,installation cocoapods,bmcustomtableview available abstr_hyperlink install,0,0,1,0,0,0,0,0
1311,usage,abstr_code_section,0,0,1,0,0,0,0,0
1312,example project,example project included repo run example project,0,0,1,0,0,0,0,0
1313,author,barbara brina,0,0,0,0,1,0,0,0
1314,license,bmcustomtableview available mit license see license file info,0,0,0,0,1,0,0,0
1315,machine learning notebooks,project aims teaching fundamentals machine learning python contains example code solutions exercises reilly book abstr_hyperlink abstr_hyperlink simply open abstr_hyperlink notebooks interested using abstr_hyperlink note abstr_hyperlink also works slower math formulas displayed correctly,1,0,1,0,0,0,0,0
1316,installation,first,0,0,1,0,0,0,0,0
1317,python required libraries,course,0,0,1,0,0,0,0,0
1318,using anaconda,using anaconda,0,0,1,0,0,0,0,0
